<?xml version="1.0" encoding="UTF-8"?>
<npc_skill_templates xmlns:xsi="http://www.w3.org/2001/XMLSchema-instance" xsi:noNamespaceSchemaLocation="npc_skills.xsd">
	<!-- Chaos Guardian Generals -->
	<npc_skills npc_ids="219887 219906 219913 236035 236048 236055">
		<npc_skill id="21750" lv="65" prob="90" min_hp="35" cd="15000" /> <!-- Slash -->
		<npc_skill id="21752" lv="1" prob="70" cd="80000" next_skill_time="5000" min_hp="0" max_hp="75" /> <!-- Searing Scream -->
		<npc_skill id="21753" lv="65" prob="85" max_hp="34" cd="15000" /> <!-- Flying Blade -->
		<npc_skill id="21756" lv="65" prob="90" next_chain_id="1" next_skill_time="0" cd="90000" min_hp="0" max_hp="45" target="RANDOM_EXCEPT_MOST_HATED" /> <!-- Prime Target -->
		<npc_skill id="21757" lv="65" prob="100" chain_id="1" cd="20000" next_skill_time="5000" /> <!-- Punishing Blow -->
		<npc_skill id="21758" lv="1" prob="70" cd="85000" next_skill_time="3000" target="NONE" /> <!-- Fetters -->
		<npc_skill id="17992" lv="1" prob="30" next_chain_id="2" next_skill_time="0" cd="120000" min_hp="0" max_hp="45" /> <!-- Wide Area Aerial Thrust III -->
		<npc_skill id="17995" lv="1" prob="100" chain_id="2" next_skill_time="8000" cd="20000" target="NONE"> <!-- Wide Area Crashing Wind Strike III -->
			<cond cond_type="TARGET_IS_AETHERS_HOLD" />
		</npc_skill>
	</npc_skills>
</npc_skill_templates>